{
  "$schema": "https://json-schema.org/draft/2020-12/schema",
  "$id": "https://private.local/codex-flow/urgent-signal.schema.json",
  "type": "object",
  "additionalProperties": false,
  "required": [
    "schema_version",
    "recipient",
    "executor_id",
    "run_id",
    "sequence",
    "supersedes_urgent_ids",
    "expires_at",
    "classification",
    "summary",
    "requested_action"
  ],
  "properties": {
    "schema_version": { "const": 1 },
    "recipient": {
      "type": "object",
      "additionalProperties": false,
      "required": ["lineage_id", "thread_id", "generation"],
      "properties": {
        "lineage_id": { "$ref": "#/$defs/safeId" },
        "thread_id": { "$ref": "#/$defs/safeId" },
        "generation": { "type": "integer", "minimum": 1, "maximum": 9007199254740991 }
      }
    },
    "executor_id": { "$ref": "#/$defs/safeId" },
    "run_id": { "$ref": "#/$defs/safeId" },
    "sequence": { "type": "integer", "minimum": 1, "maximum": 9007199254740991 },
    "supersedes_urgent_ids": {
      "type": "array",
      "maxItems": 1,
      "uniqueItems": true,
      "items": {
        "type": "string",
        "pattern": "^urgent-v1-[a-f0-9]{64}$"
      }
    },
    "expires_at": {
      "type": "string",
      "maxLength": 64,
      "pattern": "^\\d{4}-\\d{2}-\\d{2}T\\d{2}:\\d{2}:\\d{2}(?:\\.\\d+)?(?:Z|[+-](?:[01]\\d|2[0-3]):[0-5]\\d)$"
    },
    "classification": {
      "enum": ["blocker", "approval", "high-risk-drift"]
    },
    "summary": { "type": "string", "minLength": 1, "maxLength": 512 },
    "requested_action": { "type": "string", "minLength": 1, "maxLength": 512 }
  },
  "$defs": {
    "safeId": {
      "type": "string",
      "minLength": 1,
      "maxLength": 128,
      "pattern": "^[A-Za-z0-9_.-]+$"
    }
  }
}
